{
  "schema_version": "1.0.0",
  "lesson_series_id": "hls_SYNTH000000000001",
  "lesson_version_ref": "hlv_SYNTH000000000101",
  "revision": 1,
  "state": "active",
  "source_reviews": [
    {
      "review_ref": "orv_SYNTH000000000011",
      "finalized_at": "2099-01-01T10:00:00Z"
    }
  ],
  "clocks": {
    "data_as_of": "2099-01-01T09:00:00Z",
    "approved_at": "2099-01-01T11:00:00Z",
    "ingested_at": "2099-01-01T12:00:00Z",
    "generated_at": "2099-01-01T13:00:00Z"
  },
  "approval": {
    "authority_type": "human",
    "status": "approved",
    "receipt": "apr_SYNTH000000000101"
  },
  "ingestion": {
    "status": "ingested",
    "receipt": "ing_SYNTH000000000101",
    "mode": "advisory_only"
  },
  "content_ref": "ref_SYNTH000000000201"
}
